{
  "freeze_script_version": "1.1",
  "roster_freeze_date": "2026-05-22",
  "aligned_corpus_generator": {
    "active": {
      "key": "nemotron-3-super-cloud",
      "model_id": "nemotron-3-super:cloud",
      "served_model_alias": "nemotron-3-super:120b-a12b-bf16",
      "model_digest_prefix": "c14fcbcdc70e",
      "provider": "ollama_cloud",
      "developer_family": "NVIDIA/Nemotron",
      "role": "A3_candidate_generator_only",
      "selection_reason": "Best eligible generator in pre-lock bakeoff (2026-04-25): 100% pass rate (15/15) on 5-cell smoke test, max within-cell similarity 0.73, no subject/judge/extractor lineage conflict. NVIDIA family is absent from the subject/judge/extractor roster.",
      "cloud_model": true,
      "local_hash_available": false,
      "structured_output_enforced": false,
      "client_side_json_validation": true,
      "context_window_tokens": 256000,
      "license": "NVIDIA Software and Model Evaluation License",
      "ollama_client_version": "0.22.0",
      "ollama_model_show": "ollama show nemotron-3-super:cloud captured 2026-05-03: Model architecture=nemotron_h_moe; parameters=120000000000; context length=262144; embedding length=4096; quantization=NVFP4. Capabilities: completion, thinking, tools.",
      "parameters": {
        "temperature": 1.0,
        "top_p": 0.95,
        "stream": false,
        "think": false
      }
    },
    "rejected_or_archived": [
      {
        "key": "phi4-reasoning-plus-8bit",
        "reason": "Excluded from the active generator role after diversity audit (136/192 cells near-duplicate, 52/192 all-identical). Root cause: mlx_lm.server seed parameter silently ignored."
      },
      {
        "key": "cogito-2.1-671b-cloud",
        "reason": "Excluded under conservative base-lineage policy because Cogito v2.1 is a fine-tune of an archived subject-candidate lineage (Ollama metadata: family=deepseek2, architecture=deepseek2, 671B FP8)."
      },
      {
        "key": "mlx-cascade-2-30b-a3b-8bit",
        "reason": "Eligible backup but lower pass rate than Nemotron-3-Super (87% vs 100%) and same NVIDIA/Nemotron family — preferred to keep family-bakeoff explicit."
      },
      {
        "key": "rnj-1-8b-cloud",
        "reason": "Excluded after development audit: 67% pass rate. Failed canonical-argument preservation (missing 0x0000, -1000000 verbatim) and style-slot fidelity (direct_tool_invocation slot omitted required tool name). 8B scale insufficient for the structured-output task."
      }
    ]
  },
  "roster_refs": {
    "claude-opus-4-7": {
      "section": "subjects",
      "role": "subject",
      "source": "config/roster.json",
      "display_name": "Claude Opus 4.7",
      "family": "anthropic",
      "native_slug": "claude-opus-4-7",
      "openrouter_slug": "anthropic/claude-opus-4.7",
      "openrouter_pinned_provider": "anthropic",
      "ollama_cloud_slug": null,
      "ollama_cloud_digest_prefix": null,
      "local_hash_available": false,
      "freeze_mode": "api_roster_reference"
    },
    "grok-4.3": {
      "section": "subjects",
      "role": "subject",
      "source": "config/roster.json",
      "display_name": "Grok 4.3",
      "family": "xai",
      "native_slug": "grok-4.3",
      "openrouter_slug": "x-ai/grok-4.3",
      "openrouter_pinned_provider": "xai",
      "ollama_cloud_slug": null,
      "ollama_cloud_digest_prefix": null,
      "local_hash_available": false,
      "freeze_mode": "api_roster_reference"
    },
    "gpt-5.5": {
      "section": "subjects",
      "role": "subject",
      "source": "config/roster.json",
      "display_name": "GPT-5.5",
      "family": "openai",
      "native_slug": "gpt-5.5",
      "openrouter_slug": "openai/gpt-5.5",
      "openrouter_pinned_provider": "openai",
      "ollama_cloud_slug": null,
      "ollama_cloud_digest_prefix": null,
      "local_hash_available": false,
      "freeze_mode": "api_roster_reference"
    },
    "kimi-k2.6": {
      "section": "subjects",
      "role": "subject",
      "source": "config/roster.json",
      "display_name": "Kimi K2.6",
      "family": "moonshot",
      "native_slug": "kimi-k2.6",
      "openrouter_slug": "moonshotai/kimi-k2.6",
      "openrouter_pinned_provider": "moonshotai/int4",
      "ollama_cloud_slug": "kimi-k2.6:cloud",
      "ollama_cloud_digest_prefix": "a90cd0d1590",
      "local_hash_available": false,
      "freeze_mode": "api_roster_reference"
    },
    "qwen3.6-plus": {
      "section": "archived_models",
      "role": "excluded_subject_candidate",
      "source": "config/roster.json",
      "display_name": "Qwen 3.6-Plus",
      "family": "alibaba",
      "native_slug": null,
      "openrouter_slug": "qwen/qwen3.6-plus",
      "openrouter_pinned_provider": "alibaba",
      "local_hash_available": false,
      "freeze_mode": "api_roster_reference",
      "ollama_cloud_slug": null,
      "ollama_cloud_digest_prefix": null
    },
    "deepseek-v4-pro": {
      "section": "archived_models",
      "role": "excluded_subject_candidate",
      "source": "config/roster.json",
      "display_name": "DeepSeek V4-Pro",
      "family": "deepseek",
      "native_slug": "deepseek-v4-pro",
      "openrouter_slug": "deepseek/deepseek-v4-pro",
      "openrouter_pinned_provider": "deepseek",
      "ollama_cloud_slug": "deepseek-v4-pro:cloud",
      "ollama_cloud_digest_prefix": "22bfd5026abd",
      "local_hash_available": false,
      "freeze_mode": "api_roster_reference"
    },
    "glm-5.1": {
      "section": "judges",
      "role": "judge_a",
      "source": "config/roster.json",
      "display_name": "GLM 5.1",
      "family": "zai",
      "native_slug": "glm-5.1",
      "openrouter_slug": "z-ai/glm-5.1",
      "openrouter_pinned_provider": "z-ai",
      "ollama_cloud_slug": "glm-5.1:cloud",
      "ollama_cloud_digest_prefix": "59472abf9d0a",
      "local_hash_available": false,
      "freeze_mode": "api_roster_reference"
    },
    "command-a-03-2025": {
      "section": "judges",
      "role": "judge_b",
      "source": "config/roster.json",
      "display_name": "Cohere Command A (03-2025)",
      "family": "cohere",
      "native_slug": "command-a-03-2025",
      "openrouter_slug": "cohere/command-a",
      "openrouter_pinned_provider": "cohere",
      "ollama_cloud_slug": null,
      "ollama_cloud_digest_prefix": null,
      "local_hash_available": false,
      "freeze_mode": "api_roster_reference"
    },
    "mistral-large-2512": {
      "section": "judges",
      "role": "judge_c",
      "source": "config/roster.json",
      "display_name": "Mistral Large 3 (2512)",
      "family": "mistral",
      "native_slug": "mistral-large-2512",
      "openrouter_slug": "mistralai/mistral-large-2512",
      "openrouter_pinned_provider": "mistral",
      "ollama_cloud_slug": "mistral-large-3:675b-cloud",
      "ollama_cloud_digest_prefix": "3130fd5a5a1e",
      "local_hash_available": false,
      "freeze_mode": "api_roster_reference"
    },
    "minimax-2.7": {
      "section": "extractor",
      "role": "extractor",
      "source": "config/roster.json",
      "display_name": "MiniMax M2.7",
      "family": "minimax",
      "native_slug": "MiniMax-M2.7",
      "openrouter_slug": "minimax/minimax-m2.7",
      "openrouter_pinned_provider": "minimax/fp8",
      "ollama_cloud_slug": "minimax-m2.7:cloud",
      "ollama_cloud_digest_prefix": "06daa293c105",
      "local_hash_available": false,
      "freeze_mode": "api_roster_reference"
    },
    "gemini-3.5-flash": {
      "section": "subjects",
      "role": "subject",
      "source": "config/roster.json",
      "display_name": "Gemini 3.5 Flash",
      "family": "google",
      "native_slug": null,
      "openrouter_slug": "google/gemini-3.5-flash",
      "openrouter_pinned_provider": "google-ai-studio",
      "ollama_cloud_slug": null,
      "ollama_cloud_digest_prefix": null,
      "local_hash_available": false,
      "freeze_mode": "api_roster_reference"
    },
    "gpt-5.5-judge": {
      "section": "judges",
      "role": "substitute_judge_1",
      "source": "config/roster.json",
      "display_name": "GPT-5.5 (substitute judge)",
      "family": "openai",
      "native_slug": "gpt-5.5",
      "openrouter_slug": "openai/gpt-5.5",
      "openrouter_pinned_provider": "openai",
      "ollama_cloud_slug": null,
      "ollama_cloud_digest_prefix": null,
      "local_hash_available": false,
      "freeze_mode": "api_roster_reference"
    },
    "claude-opus-4-7-judge": {
      "section": "judges",
      "role": "substitute_judge_2",
      "source": "config/roster.json",
      "display_name": "Claude Opus 4.7 (substitute judge)",
      "family": "anthropic",
      "native_slug": "claude-opus-4-7",
      "openrouter_slug": "anthropic/claude-opus-4.7",
      "openrouter_pinned_provider": "anthropic",
      "ollama_cloud_slug": null,
      "ollama_cloud_digest_prefix": null,
      "local_hash_available": false,
      "freeze_mode": "api_roster_reference"
    },
    "gpt-oss-120b": {
      "section": "archived_models",
      "role": "excluded_subject_candidate",
      "source": "config/roster.json",
      "display_name": "GPT-OSS-120B",
      "family": "openai",
      "native_slug": null,
      "openrouter_slug": null,
      "openrouter_pinned_provider": null,
      "ollama_cloud_slug": null,
      "ollama_cloud_digest_prefix": null,
      "local_hash_available": false,
      "freeze_mode": "api_roster_reference"
    },
    "minimax-2.7-subject-candidate": {
      "section": "archived_models",
      "role": "excluded_subject_candidate",
      "source": "config/roster.json",
      "display_name": "MiniMax M2.7 subject candidate",
      "family": "minimax",
      "native_slug": null,
      "openrouter_slug": null,
      "openrouter_pinned_provider": null,
      "ollama_cloud_slug": null,
      "ollama_cloud_digest_prefix": null,
      "local_hash_available": false,
      "freeze_mode": "api_roster_reference"
    },
    "glm-5.1-subject-candidate": {